{
  "schemaVersion": "1.0",
  "id": "ci-zk",
  "title": "初中英语时文阅读｜提分训练3+X｜中考（第3辑）",
  "shortTitle": "时文阅读 中考",
  "series": "Current Insights 时文阅读 提分训练3+X",
  "publisher": "上海学生英文报 编 / 华东理工大学出版社",
  "gradeBand": "G9",
  "description": "90 篇外刊时文，18 周每日一练：阅读单选、完形填空、选词填空、七选五、回答问题、短文填空、表格填空与每周精读。",
  "locale": "en",
  "cover": "assets/ci-zk/cover.jpg",
  "accent": "#C8463D",
  "itemIds": [
    "ci-zk-w01-mon",
    "ci-zk-w01-tue",
    "ci-zk-w01-wed",
    "ci-zk-w01-thu",
    "ci-zk-w01-fri",
    "ci-zk-w02-mon",
    "ci-zk-w02-tue",
    "ci-zk-w02-wed",
    "ci-zk-w02-thu",
    "ci-zk-w02-fri",
    "ci-zk-w03-mon",
    "ci-zk-w03-tue",
    "ci-zk-w03-wed",
    "ci-zk-w03-thu",
    "ci-zk-w03-fri",
    "ci-zk-w04-mon",
    "ci-zk-w04-tue",
    "ci-zk-w04-wed",
    "ci-zk-w04-thu",
    "ci-zk-w04-fri",
    "ci-zk-w05-mon",
    "ci-zk-w05-tue",
    "ci-zk-w05-wed",
    "ci-zk-w05-thu",
    "ci-zk-w05-fri",
    "ci-zk-w06-mon",
    "ci-zk-w06-tue",
    "ci-zk-w06-wed",
    "ci-zk-w06-thu",
    "ci-zk-w06-fri",
    "ci-zk-w07-mon",
    "ci-zk-w07-tue",
    "ci-zk-w07-wed",
    "ci-zk-w07-thu",
    "ci-zk-w07-fri",
    "ci-zk-w08-mon",
    "ci-zk-w08-tue",
    "ci-zk-w08-wed",
    "ci-zk-w08-thu",
    "ci-zk-w08-fri",
    "ci-zk-w09-mon",
    "ci-zk-w09-tue",
    "ci-zk-w09-wed",
    "ci-zk-w09-thu",
    "ci-zk-w09-fri",
    "ci-zk-w10-mon",
    "ci-zk-w10-tue",
    "ci-zk-w10-wed",
    "ci-zk-w10-thu",
    "ci-zk-w10-fri",
    "ci-zk-w11-mon",
    "ci-zk-w11-tue",
    "ci-zk-w11-wed",
    "ci-zk-w11-thu",
    "ci-zk-w11-fri",
    "ci-zk-w12-mon",
    "ci-zk-w12-tue",
    "ci-zk-w12-wed",
    "ci-zk-w12-thu",
    "ci-zk-w12-fri",
    "ci-zk-w13-mon",
    "ci-zk-w13-tue",
    "ci-zk-w13-wed",
    "ci-zk-w13-thu",
    "ci-zk-w13-fri",
    "ci-zk-w14-mon",
    "ci-zk-w14-tue",
    "ci-zk-w14-wed",
    "ci-zk-w14-thu",
    "ci-zk-w14-fri",
    "ci-zk-w15-mon",
    "ci-zk-w15-tue",
    "ci-zk-w15-wed",
    "ci-zk-w15-thu",
    "ci-zk-w15-fri",
    "ci-zk-w16-mon",
    "ci-zk-w16-tue",
    "ci-zk-w16-wed",
    "ci-zk-w16-thu",
    "ci-zk-w16-fri",
    "ci-zk-w17-mon",
    "ci-zk-w17-tue",
    "ci-zk-w17-wed",
    "ci-zk-w17-thu",
    "ci-zk-w17-fri",
    "ci-zk-w18-mon",
    "ci-zk-w18-tue",
    "ci-zk-w18-wed",
    "ci-zk-w18-thu",
    "ci-zk-w18-fri"
  ],
  "version": "0.1.0"
}
